1888,AJC4QGCJ39VB1,3,319,"Your participation in this research is voluntary, your medical care will be unaffected if you decline to take part.",2019-11-22 12:06:19,98,419
1889,AJC4QGCJ39VB1,3,346,The research study will provide us with ideas on how best to develop a workshop for men with prostate cancer.,2019-11-22 12:07:26,98,419
1890,AJC4QGCJ39VB1,4,406,Support will be available to assist you with the information sheet and answer any questions you may have.,2019-11-22 12:08:41,98,419
1891,AJC4QGCJ39VB1,4,418,We want to learn how a prostate cancer affects your health and well-being.,2019-11-22 12:09:39,98,419
1892,A2V9ON1EW2TC60,2,0,,2019-11-22 14:11:25,98,419
1893,A2V9ON1EW2TC60,4,450,"When you are struggling with the experience, please ask for support and we will provide useful details.",2019-11-22 14:12:31,98,419
1894,A2V9ON1EW2TC60,2,232,"After answering the questions on the answer sheet, you will be asked if you are happy with the participation",2019-11-22 14:13:15,98,419
1895,A1RX3Z8XFJ8VJ1,2,0,,2019-11-22 14:14:00,98,419
1896,A2V9ON1EW2TC60,2,264,Data you provide to the research will be analysed and conducted into a research study.,2019-11-22 14:14:12,98,419
1897,A2V9ON1EW2TC60,2,2100,"If you agree to NHS collecting routine data using your NHS and hospital numbers, your name will be removed.",2019-11-22 14:15:08,98,419
1898,A2V9ON1EW2TC60,3,312,There will be a informational workshop held as a part of the Care Programme for men guiding them how to manage prostate cancer related problems.,2019-11-22 14:16:47,98,419
1899,A1RX3Z8XFJ8VJ1,4,450,If you think feeling difficult then we give details of more support,2019-11-22 14:17:27,98,419
1900,A2V9ON1EW2TC60,3,319,"You are taking part of this research our of your own free will, note that nothing about your medical care will change your mind not to take part in the study.",2019-11-22 14:19:01,98,419
1901,A2V9ON1EW2TC60,3,346,The aim of the study is to develop useful workshop tailored for men with prostate cancer.,2019-11-22 14:19:58,98,419
1902,A1RX3Z8XFJ8VJ1,2,232,Are you ready to take part in study after going through the details.,2019-11-22 14:20:20,98,419
1903,A2V9ON1EW2TC60,4,406,You can ask a nurse or a member of your clinical team anything about the research and details in the information sheet.,2019-11-22 14:20:56,98,419
1904,A1RX3Z8XFJ8VJ1,2,264,It means your data will be used in research study,2019-11-22 14:21:24,98,419
1905,A2V9ON1EW2TC60,4,418,We are interested how a diagnosis of prostate cancer and treatment affects a person.,2019-11-22 14:21:37,98,419
1906,A1RX3Z8XFJ8VJ1,2,2100,Name will be erased from NHS and hospital id,2019-11-22 14:23:50,98,419
1907,A1RX3Z8XFJ8VJ1,3,312,your Participation in Care program for prostrate cancer will help patients,2019-11-22 14:26:46,98,419
1908,A1RX3Z8XFJ8VJ1,3,319,Taking part in research not mandatory ,2019-11-22 14:27:56,98,419
1909,A1RX3Z8XFJ8VJ1,3,346,This research is to develop work shop for prostrate cancer for men ,2019-11-22 14:29:51,98,419
1910,A1RX3Z8XFJ8VJ1,4,406,Professional staff will answer your queries by going through Case sheet,2019-11-22 14:31:48,98,419
1911,AR44AFW993KRR,2,0,,2019-11-22 14:33:37,98,419
1912,AR44AFW993KRR,4,450,Further support details can be provided if you encounter any difficulties,2019-11-22 14:34:36,98,419
1913,A1RX3Z8XFJ8VJ1,4,418,Research is for study of pros and cons for diagnosis of prostrate cancer,2019-11-22 14:36:26,98,419
1914,AR44AFW993KRR,2,232,Once you are OK with the information on the sheet provided you will be asked if you want to proceed with the study,2019-11-22 14:36:41,98,419
1915,AR44AFW993KRR,2,264,When you agree to take part in the study your data will be used as part of the research,2019-11-22 14:38:44,98,419
1916,AR44AFW993KRR,2,2100,"If you have agreed for us to use your NHS data it will be tracked using your NHS and hospital number, your name will not be used",2019-11-22 14:40:40,98,419
1917,AR44AFW993KRR,3,312,The Care Programme includes a workshop for men with prostate cancer to help them better manage any problems,2019-11-22 14:41:47,98,419
1918,AR44AFW993KRR,3,319,"No, this research is voluntary. Your medical care will not change if you do not wish to partake",2019-11-22 14:43:27,98,419
1919,AR44AFW993KRR,3,346,"As a result of this research a workshop will be developed, using your views, which will help men with prostate cancer",2019-11-22 14:45:44,98,419
1920,AR44AFW993KRR,4,406,Any questions you have after reading the information sheet can be discussed with a research nurse or member of the clinical team,2019-11-22 14:46:48,98,419
1921,AR44AFW993KRR,4,418,We want to find out how your health and well being are affected by the diagnosis and treatment of prostate cancer,2019-11-22 14:48:26,98,419
1922,ASL2H1XNE9Y6W,2,0,,2019-11-22 17:27:43,98,419
1923,ASL2H1XNE9Y6W,2,0,,2019-11-22 17:29:16,98,419
1924,ASL2H1XNE9Y6W,4,450,You may find your experience difficult for a number of reasons. We will give you details of support you can access that can help you.,2019-11-22 17:32:20,98,419
1925,ASL2H1XNE9Y6W,2,232,Once you have read the information sheet you will be able to ask any questions you may still have. After that you will be asked if you are happy to take part in the study.,2019-11-22 17:35:11,98,419
1926,ASL2H1XNE9Y6W,2,264,When you agree to take part in a research study you are allowing us to use and analyse your data in several ways to conduct our research.,2019-11-22 17:38:21,98,419
1927,ASL2H1XNE9Y6W,2,2100,If you agree that we can collect routine NHS data about you we shall do so anonymously by using only your NHS and hospital numbers.,2019-11-22 17:41:27,98,419
1928,ASL2H1XNE9Y6W,3,312,As Part of our Care Programme we will hold a workshop for those with prostate cancer discussing and demonstrating ways to help manage any cancer-related problems and issues that frequently arise.,2019-11-22 17:45:37,98,419
1929,ASL2H1XNE9Y6W,3,319,"You do not have to take part in this research, it is voluntary and your medical care will not be affected at all by your decision.",2019-11-22 17:47:51,98,419
1930,ASL2H1XNE9Y6W,3,346,"Our research hopes to develop a useful, helpful workshop for those with prostate cancer, and we would use your views and opinions to help us.",2019-11-22 17:50:57,98,419
1931,ASL2H1XNE9Y6W,4,406,A member of your clinical team will go through the information sheet with you and will be able to answer any questions you still have.,2019-11-22 17:52:08,98,419
1932,ASL2H1XNE9Y6W,4,418,One to the things we would like to understand more is how the diagnosis and treatment of prostate cancer can affect a person's overall physical and mental health.,2019-11-22 17:54:12,98,419
1933,A3K4XDVBJH7XBG,2,0,,2019-11-23 06:41:10,98,419
1934,A3K4XDVBJH7XBG,4,450,We can always assist you to get further support in case you expect a better experience.,2019-11-23 06:44:11,98,419
1935,A3K4XDVBJH7XBG,2,232,"After reading the information sheet and satisfying your curiosity, you'll be invited to participate in the study.",2019-11-23 06:49:50,98,419
1936,A3K4XDVBJH7XBG,2,264,"As you agree to participate, you consent to share your data for further research.",2019-11-23 06:52:49,98,419
1937,A3K4XDVBJH7XBG,2,2100,"If you allow us to collect routine NHS data, which is tracked via NHS and hospital numbers, your name will be concealed.",2019-11-23 06:58:35,98,419
1938,A3K4XDVBJH7XBG,3,312,"As part of the Care Programme, there will be a workshop for men with prostate cancer to better help them manage any related issues.",2019-11-23 07:01:00,98,419
1939,A3K4XDVBJH7XBG,3,319,Participation is voluntary and your medical care won't be affected regardless of your choice.,2019-11-23 07:03:03,98,419
1940,A3K4XDVBJH7XBG,3,346,The purpose of this research is to enhance the quality of a workshop we are developing to help men with prostate cancer with your contribution.,2019-11-23 07:09:10,98,419
1941,A3K4XDVBJH7XBG,4,406,A member of the clinical team will go through the information sheet with you to provide any claryfication required.,2019-11-23 07:11:14,98,419
1942,A3K4XDVBJH7XBG,4,418,"We are curious about how a prostate cancer diagnosis, along with treatment, affects someone's overall well-being.",2019-11-23 07:15:27,98,419
1943,A37QTEIPY5Q7DS,2,0,,2019-11-23 10:00:27,98,419
1944,A37QTEIPY5Q7DS,4,450,Details of where to get support will be provided if you are finding any part of the experience difficult.,2019-11-23 10:01:21,98,419
1945,A37QTEIPY5Q7DS\,2,232,You will be asked whether you are happy to participate in the study once you have read the information sheet.,2019-11-23 10:04:19,98,419
1946,A37QTEIPY5Q7DS,2,264,Therefore when you agree to take part your data will be used to conduct the study.,2019-11-23 10:07:32,98,419
1947,A37QTEIPY5Q7DS,2,2100,If you agree for your NHS data to be collected your name will be removed and your NHS number will be used to track it.,2019-11-23 10:14:07,98,419
1948,A37QTEIPY5Q7DS,3,312,A workshop for management of male prostate cancer will be part of the care programme.,2019-11-23 10:17:23,98,419
1949,A37QTEIPY5Q7DS,3,319,Your medical care will not be affected if you do not take part in this voluntary research.,2019-11-23 10:18:10,98,419
1950,A37QTEIPY5Q7DS,3,346,Your views will be used to help develop a helpful workshop for men with prostate cancer.,2019-11-23 10:20:10,98,419
1951,A37QTEIPY5Q7DS,4,406,The information sheet and any questions will be dealt with by a member of the clinical team or a research nurse.,2019-11-23 10:33:10,98,419
1952,A37QTEIPY5Q7DS,4,418,We are looking into the effects of a prostate cancer diagnosis,2019-11-23 11:23:28,98,419
