idCrwRevision,0,idReviser,1,idLeaflet,2,idSentence,3,crwRevision,4,dateT,5,flag,6,idGroup,7
1087,1087,A26FOB7B8AG3MI,A26FOB7B8AG3MI,2,2,264,264,"It implies by taking part in the study you are willing to share the data for analysis and research purposes.","It implies by taking part in the study you are willing to share the data for analysis and research purposes.","2019-11-17 22:36:17","2019-11-17 22:36:17",419,419,19,19
1088,1088,A26FOB7B8AG3MI,A26FOB7B8AG3MI,2,2,2100,2100,"If you agreed for us to collect NHS data, then it can be tracked using NHS and hospital numbers and your name will not be used anywhere ","If you agreed for us to collect NHS data, then it can be tracked using NHS and hospital numbers and your name will not be used anywhere ","2019-11-17 22:38:41","2019-11-17 22:38:41",419,419,19,19
1089,1089,ARVI4C0REM69B,ARVI4C0REM69B,2,2,264,264,"By agreeing to take part in the study, you also agree that as part of the study, we can examine your personal data as part of the research.","By agreeing to take part in the study, you also agree that as part of the study, we can examine your personal data as part of the research.","2019-11-17 22:38:53","2019-11-17 22:38:53",419,419,19,19
1090,1090,ARVI4C0REM69B,ARVI4C0REM69B,2,2,2100,2100,"If you gave consent for us to collect your routine NHS information, we will track this with your NHS and hospital numbers but we will remove your name to protect your identity.","If you gave consent for us to collect your routine NHS information, we will track this with your NHS and hospital numbers but we will remove your name to protect your identity.","2019-11-17 22:41:32","2019-11-17 22:41:32",419,419,19,19
1091,1091,A26FOB7B8AG3MI,A26FOB7B8AG3MI,3,3,312,312,"The care program will conduct workshop for men with prostate cancer, which will guide them to effectively manage any disease related  issue","The care program will conduct workshop for men with prostate cancer, which will guide them to effectively manage any disease related  issue","2019-11-17 22:41:36","2019-11-17 22:41:36",419,419,19,19
1092,1092,ARVI4C0REM69B,ARVI4C0REM69B,3,3,312,312,"As part of the Care Programme, there will be a support workshop for men with prostate cancer. This is to help them deal with and manage any issues they might have in regards to prostate cancer.","As part of the Care Programme, there will be a support workshop for men with prostate cancer. This is to help them deal with and manage any issues they might have in regards to prostate cancer.","2019-11-17 22:42:13","2019-11-17 22:42:13",419,419,19,19
1093,1093,A26FOB7B8AG3MI,A26FOB7B8AG3MI,3,3,319,319,"Taking part in the study is voluntary it will not affect your ongoing medical care","Taking part in the study is voluntary it will not affect your ongoing medical care","2019-11-17 22:42:46","2019-11-17 22:42:46",419,419,19,19
1094,1094,ARVI4C0REM69B,ARVI4C0REM69B,3,3,319,319,"You do not have to take part in this research. It is entirely voluntary. If you decide you do not wish to take part, it will not affect any medical care you are due to receive. ","You do not have to take part in this research. It is entirely voluntary. If you decide you do not wish to take part, it will not affect any medical care you are due to receive. ","2019-11-17 22:43:10","2019-11-17 22:43:10",419,419,19,19
1095,1095,ARVI4C0REM69B,ARVI4C0REM69B,3,3,346,346,"The aim of this research is to allow us to develop and run a workshop which gives the right level of support for men with prostate cancer. Your feedback will help us identify what we need to do to make this workshop a success.","The aim of this research is to allow us to develop and run a workshop which gives the right level of support for men with prostate cancer. Your feedback will help us identify what we need to do to make this workshop a success.","2019-11-17 22:44:15","2019-11-17 22:44:15",419,419,19,19
1096,1096,A26FOB7B8AG3MI,A26FOB7B8AG3MI,3,3,346,346,"The objective of research study is to design workshop for men with prostate cancer using your opinions","The objective of research study is to design workshop for men with prostate cancer using your opinions","2019-11-17 22:44:57","2019-11-17 22:44:57",419,419,19,19
1097,1097,ARVI4C0REM69B,ARVI4C0REM69B,4,4,406,406,"You will be given an information sheet. A research nurse or a member of your clinical team will be available to help you understand the sheet or answer any questions you might have. ","You will be given an information sheet. A research nurse or a member of your clinical team will be available to help you understand the sheet or answer any questions you might have. ","2019-11-17 22:45:07","2019-11-17 22:45:07",419,419,19,19
1098,1098,ARVI4C0REM69B,ARVI4C0REM69B,4,4,418,418,"We want to know how being diagnosed with prostate cancer, and the treatment of that cancer, can affect someone's health and well-being.","We want to know how being diagnosed with prostate cancer, and the treatment of that cancer, can affect someone's health and well-being.","2019-11-17 22:45:37","2019-11-17 22:45:37",419,419,19,19
1099,1099,ARVI4C0REM69B,ARVI4C0REM69B,4,4,450,450,"Should you find the experience difficult or challenging and would like help, we can give you details of places where you can get extra support.","Should you find the experience difficult or challenging and would like help, we can give you details of places where you can get extra support.","2019-11-17 22:46:50","2019-11-17 22:46:50",419,419,19,19
1100,1100,A26FOB7B8AG3MI,A26FOB7B8AG3MI,4,4,406,406,"The research nurse or member of your clinical team will take you through the information sheet and clarify questions","The research nurse or member of your clinical team will take you through the information sheet and clarify questions","2019-11-17 22:46:51","2019-11-17 22:46:51",419,419,19,19
1101,1101,A26FOB7B8AG3MI,A26FOB7B8AG3MI,4,4,418,418,,,"2019-11-17 22:49:00","2019-11-17 22:49:00",419,419,19,19
1102,1102,A26FOB7B8AG3MI,A26FOB7B8AG3MI,4,4,450,450,"We can provide guidance in terms of more support in case you find any aspect of the experience to be difficult","We can provide guidance in terms of more support in case you find any aspect of the experience to be difficult","2019-11-17 22:50:58","2019-11-17 22:50:58",419,419,19,19
1103,1103,A18UALFVQ3CQIX,A18UALFVQ3CQIX,2,2,0,0,,,"2019-11-17 23:09:51","2019-11-17 23:09:51",419,419,19,19
1104,1104,A18UALFVQ3CQIX,A18UALFVQ3CQIX,2,2,232,232,"After reading the information sheet and answering the questions, you will be asked if you are happy to be a part of the study.","After reading the information sheet and answering the questions, you will be asked if you are happy to be a part of the study.","2019-11-17 23:12:04","2019-11-17 23:12:04",419,419,19,19
1105,1105,A18UALFVQ3CQIX,A18UALFVQ3CQIX,2,2,264,264,"This means that when you agree to take part in a research study, your data will be used by us for conducting and analysing the research study.","This means that when you agree to take part in a research study, your data will be used by us for conducting and analysing the research study.","2019-11-17 23:13:22","2019-11-17 23:13:22",419,419,19,19
1106,1106,A18UALFVQ3CQIX,A18UALFVQ3CQIX,2,2,2100,2100,"If you have permitted us to collect regular NHS data this will be followed using your NHS and hospital numbers without showing your name.","If you have permitted us to collect regular NHS data this will be followed using your NHS and hospital numbers without showing your name.","2019-11-17 23:16:10","2019-11-17 23:16:10",419,419,19,19
1107,1107,A18UALFVQ3CQIX,A18UALFVQ3CQIX,3,3,312,312,"One of the Care Programme is a workshop for men having prostate cancer. It will help them to handle their prostate cancer-related issues.","One of the Care Programme is a workshop for men having prostate cancer. It will help them to handle their prostate cancer-related issues.","2019-11-17 23:18:03","2019-11-17 23:18:03",419,419,19,19
1108,1108,A18UALFVQ3CQIX,A18UALFVQ3CQIX,3,3,319,319,"No, being a part of the research is not compulsory and your medical care will not be affected if you don't take part.","No, being a part of the research is not compulsory and your medical care will not be affected if you don't take part.","2019-11-17 23:19:33","2019-11-17 23:19:33",419,419,19,19
1109,1109,A18UALFVQ3CQIX,A18UALFVQ3CQIX,3,3,346,346,"The research's purpose is to establish a workshop suitable for men with prostate cancer and your opinion will be used to do this.","The research's purpose is to establish a workshop suitable for men with prostate cancer and your opinion will be used to do this.","2019-11-17 23:20:56","2019-11-17 23:20:56",419,419,19,19
1110,1110,A18UALFVQ3CQIX,A18UALFVQ3CQIX,4,4,406,406,"Your clinical team's research nurse or member will read your information sheer with you and answer your questions.","Your clinical team's research nurse or member will read your information sheer with you and answer your questions.","2019-11-17 23:22:06","2019-11-17 23:22:06",419,419,19,19
1111,1111,A18UALFVQ3CQIX,A18UALFVQ3CQIX,4,4,418,418,"Our interests are in how prostate cancer's diagnosis and its treatment affect the health and well-being of a person.","Our interests are in how prostate cancer's diagnosis and its treatment affect the health and well-being of a person.","2019-11-17 23:23:30","2019-11-17 23:23:30",419,419,19,19
1112,1112,A18UALFVQ3CQIX,A18UALFVQ3CQIX,4,4,450,450,"If you find any difficulties in your experience, we can provide you with details for more support.","If you find any difficulties in your experience, we can provide you with details for more support.","2019-11-17 23:24:22","2019-11-17 23:24:22",419,419,19,19
1113,1113,A39NFW2FOEG898,A39NFW2FOEG898,2,2,0,0,,,"2019-11-18 01:50:00","2019-11-18 01:50:00",419,419,19,19
1114,1114,A39NFW2FOEG898,A39NFW2FOEG898,2,2,232,232,,,"2019-11-18 01:50:08","2019-11-18 01:50:08",419,419,19,19
1115,1115,A39NFW2FOEG898,A39NFW2FOEG898,2,2,264,264,yes,yes,"2019-11-18 01:50:39","2019-11-18 01:50:39",419,419,19,19
1116,1116,A39NFW2FOEG898,A39NFW2FOEG898,2,2,2100,2100,"HEALTH RECORDS","HEALTH RECORDS","2019-11-18 01:51:26","2019-11-18 01:51:26",419,419,19,19
1117,1117,A39NFW2FOEG898,A39NFW2FOEG898,3,3,312,312,"HEALTH DEPARTMENT","HEALTH DEPARTMENT","2019-11-18 01:51:44","2019-11-18 01:51:44",419,419,19,19
1118,1118,A39NFW2FOEG898,A39NFW2FOEG898,3,3,319,319,"Health care, health-care, or healthcare is the maintenance or improvement of health via the prevention, diagnosis, and treatment of disease, illness, injury, and other physical and mental impairments in people. Health care is delivered by health professionals in allied health fields. Wikipedia
","Health care, health-care, or healthcare is the maintenance or improvement of health via the prevention, diagnosis, and treatment of disease, illness, injury, and other physical and mental impairments in people. Health care is delivered by health professionals in allied health fields. Wikipedia
","2019-11-18 01:53:06","2019-11-18 01:53:06",419,419,19,19
1119,1119,"Health care, health-","Health care, health-",3,3,346,346,,,"2019-11-18 01:53:12","2019-11-18 01:53:12",419,419,19,19
1120,1120,"Health care, health-","Health care, health-",4,4,406,406,,,"2019-11-18 01:53:16","2019-11-18 01:53:16",419,419,19,19
1121,1121,"Health care, health-","Health care, health-",4,4,418,418,,,"2019-11-18 01:53:20","2019-11-18 01:53:20",419,419,19,19
1122,1122,A39NFW2FOEG898,A39NFW2FOEG898,4,4,450,450,"Health care, health-care, or healthcare is the maintenance or improvement of health via the prevention, diagnosis, and treatment of disease, illness, injury, and other physical and mental impairments in people. Health care is delivered by health professionals in allied health fields. Wikipedia
","Health care, health-care, or healthcare is the maintenance or improvement of health via the prevention, diagnosis, and treatment of disease, illness, injury, and other physical and mental impairments in people. Health care is delivered by health professionals in allied health fields. Wikipedia
","2019-11-18 01:53:40","2019-11-18 01:53:40",419,419,19,19
1123,1123,A1LQSODJ1E706K,A1LQSODJ1E706K,2,2,0,0,,,"2019-11-18 06:05:11","2019-11-18 06:05:11",419,419,19,19
1124,1124,A1LQSODJ1E706K,A1LQSODJ1E706K,2,2,232,232,,,"2019-11-18 06:05:39","2019-11-18 06:05:39",419,419,19,19
1125,1125,AX0HTB5102YQT,AX0HTB5102YQT,2,2,0,0,,,"2019-11-18 06:09:52","2019-11-18 06:09:52",419,419,19,19
1126,1126,AX0HTB5102YQT,AX0HTB5102YQT,2,2,232,232,,,"2019-11-18 06:10:00","2019-11-18 06:10:00",419,419,19,19
1127,1127,A1RS7VDO8Y1S07,A1RS7VDO8Y1S07,2,2,0,0,,,"2019-11-18 07:42:49","2019-11-18 07:42:49",419,419,21,21
1128,1128,A1RS7VDO8Y1S07,A1RS7VDO8Y1S07,2,2,264,264,"When you agree to take part in research study, We will use the data to conduct and analyse it. ","When you agree to take part in research study, We will use the data to conduct and analyse it. ","2019-11-18 07:46:56","2019-11-18 07:46:56",419,419,21,21
1129,1129,A1RS7VDO8Y1S07,A1RS7VDO8Y1S07,2,2,2100,2100,"If you agree, NHS data will be tracked using NHS and hospital numbers. But name will be removed.","If you agree, NHS data will be tracked using NHS and hospital numbers. But name will be removed.","2019-11-18 07:55:08","2019-11-18 07:55:08",419,419,21,21
1130,1130,A1RS7VDO8Y1S07,A1RS7VDO8Y1S07,3,3,312,312,"Part of the Care Programme will be a workshop for prostate cancer patients, which will be very useful for them to manage.","Part of the Care Programme will be a workshop for prostate cancer patients, which will be very useful for them to manage.","2019-11-18 07:58:15","2019-11-18 07:58:15",419,419,21,21
1131,1131,AUZUHON52J10U,AUZUHON52J10U,2,2,0,0,,,"2019-11-18 08:01:34","2019-11-18 08:01:34",419,419,21,21
1132,1132,AUZUHON52J10U,AUZUHON52J10U,2,2,264,264,,,"2019-11-18 08:01:59","2019-11-18 08:01:59",419,419,21,21
1133,1133,A1RS7VDO8Y1S07,A1RS7VDO8Y1S07,3,3,319,319,"Taking part in this research is voluntary.But it will not be affected if you decide not to take part of it.","Taking part in this research is voluntary.But it will not be affected if you decide not to take part of it.","2019-11-18 08:02:38","2019-11-18 08:02:38",419,419,21,21
1134,1134,A1RS7VDO8Y1S07,A1RS7VDO8Y1S07,3,3,346,346,"The main purpose is to develop a workshop for men with prostate cancer and this will help to do this.","The main purpose is to develop a workshop for men with prostate cancer and this will help to do this.","2019-11-18 08:04:27","2019-11-18 08:04:27",419,419,21,21
1135,1135,A1RS7VDO8Y1S07,A1RS7VDO8Y1S07,4,4,406,406,"Either research nurse or member of your clinical team will go through the information sheet and they will answers your question.","Either research nurse or member of your clinical team will go through the information sheet and they will answers your question.","2019-11-18 08:08:34","2019-11-18 08:08:34",419,419,21,21
1136,1136,A1RS7VDO8Y1S07,A1RS7VDO8Y1S07,4,4,418,418,"We are interested in how the prostate cancer has been diagnosed and treated and its affects on person's health.","We are interested in how the prostate cancer has been diagnosed and treated and its affects on person's health.","2019-11-18 08:14:53","2019-11-18 08:14:53",419,419,21,21
1137,1137,A1RS7VDO8Y1S07,A1RS7VDO8Y1S07,4,4,450,450,"If you are finding any difficulty in experience, we can provide you a more support with details.","If you are finding any difficulty in experience, we can provide you a more support with details.","2019-11-18 08:19:29","2019-11-18 08:19:29",419,419,21,21
1138,1138,A25RJ54AHZGDOO,A25RJ54AHZGDOO,2,2,0,0,,,"2019-11-18 08:40:07","2019-11-18 08:40:07",419,419,19,19
1139,1139,A1RS7VDO8Y1S07,A1RS7VDO8Y1S07,2,2,232,232,"after you have read the information sheet and if the questions were answered then you will be asked whether you are happy to take part in the study","after you have read the information sheet and if the questions were answered then you will be asked whether you are happy to take part in the study","2019-11-18 08:40:18","2019-11-18 08:40:18",419,419,21,21
1140,1140,A25RJ54AHZGDOO,A25RJ54AHZGDOO,2,2,232,232,"Having read the information sheet and had any questions answered, you will be asked if you wish to proceed in the study.","Having read the information sheet and had any questions answered, you will be asked if you wish to proceed in the study.","2019-11-18 08:44:52","2019-11-18 08:44:52",419,419,19,19
1141,1141,A3EIM0G0H9D23X,A3EIM0G0H9D23X,2,2,0,0,,,"2019-11-18 08:53:36","2019-11-18 08:53:36",419,419,21,21
1142,1142,A25RJ54AHZGDOO,A25RJ54AHZGDOO,2,2,264,264,"That is, when you agree to participate in a research study, we'll use your data in ways required to run and analyse the study.","That is, when you agree to participate in a research study, we'll use your data in ways required to run and analyse the study.","2019-11-18 08:53:59","2019-11-18 08:53:59",419,419,19,19
1143,1143,A3EIM0G0H9D23X,A3EIM0G0H9D23X,2,2,264,264,"To allow us to conduct our research study, your data will be used, and analysed once you agree to take part.","To allow us to conduct our research study, your data will be used, and analysed once you agree to take part.","2019-11-18 08:58:57","2019-11-18 08:58:57",419,419,21,21
1144,1144,A25RJ54AHZGDOO,A25RJ54AHZGDOO,2,2,2100,2100,"If you've agreed we can use NHS data it will be tracked using your NHS and hospital numbers. Your name will be removed.","If you've agreed we can use NHS data it will be tracked using your NHS and hospital numbers. Your name will be removed.","2019-11-18 09:00:24","2019-11-18 09:00:24",419,419,19,19
1145,1145,A3EIM0G0H9D23X,A3EIM0G0H9D23X,2,2,2100,2100,"If you agree to its collection, your routine NHS data will be tracked, and identified only by NHS and hospital numbers, not by your name.","If you agree to its collection, your routine NHS data will be tracked, and identified only by NHS and hospital numbers, not by your name.","2019-11-18 09:04:30","2019-11-18 09:04:30",419,419,21,21
1146,1146,A25RJ54AHZGDOO,A25RJ54AHZGDOO,3,3,312,312,"The Care Programme will have a workshop for men with prostate cancer. This will help them better manage any disease related issues.","The Care Programme will have a workshop for men with prostate cancer. This will help them better manage any disease related issues.","2019-11-18 09:04:51","2019-11-18 09:04:51",419,419,19,19
1147,1147,A3EIM0G0H9D23X,A3EIM0G0H9D23X,3,3,312,312,"Men with prostate cancer will learn to better manage any cancer related issues as part of the Care Programme workshop.","Men with prostate cancer will learn to better manage any cancer related issues as part of the Care Programme workshop.","2019-11-18 09:06:32","2019-11-18 09:06:32",419,419,21,21
1148,1148,A3EIM0G0H9D23X,A3EIM0G0H9D23X,3,3,319,319,"Your medical care will only be affected if you volunteer to take part in this research.","Your medical care will only be affected if you volunteer to take part in this research.","2019-11-18 09:08:00","2019-11-18 09:08:00",419,419,21,21
1149,1149,A3EIM0G0H9D23X,A3EIM0G0H9D23X,3,3,346,346,"Your views will help our research in developing a workshop to better help men with prostate cancer.","Your views will help our research in developing a workshop to better help men with prostate cancer.","2019-11-18 09:09:29","2019-11-18 09:09:29",419,419,21,21
1150,1150,A25RJ54AHZGDOO,A25RJ54AHZGDOO,3,3,319,319,"No, taking part is voluntary and your medical care is unaffected by your decision in this matter.","No, taking part is voluntary and your medical care is unaffected by your decision in this matter.","2019-11-18 09:09:58","2019-11-18 09:09:58",419,419,19,19
1151,1151,A3EIM0G0H9D23X,A3EIM0G0H9D23X,4,4,406,406,"Your questions will be answered by a research nurse, or member of your clinical team, using the information sheet.","Your questions will be answered by a research nurse, or member of your clinical team, using the information sheet.","2019-11-18 09:11:19","2019-11-18 09:11:19",419,419,21,21
1152,1152,A25RJ54AHZGDOO,A25RJ54AHZGDOO,3,3,346,346,"Your views will be used in the research to help develop a workshop specifically for men with prostate cancer.","Your views will be used in the research to help develop a workshop specifically for men with prostate cancer.","2019-11-18 09:14:12","2019-11-18 09:14:12",419,419,19,19
1153,1153,A3EIM0G0H9D23X,A3EIM0G0H9D23X,4,4,418,418,"We want to learn about your health and well-being, after being diagnosed with prostate cancer, and through your treatment.","We want to learn about your health and well-being, after being diagnosed with prostate cancer, and through your treatment.","2019-11-18 09:14:35","2019-11-18 09:14:35",419,419,21,21
1154,1154,A25RJ54AHZGDOO,A25RJ54AHZGDOO,4,4,406,406,"The research nurse or clinical team member will explain the information sheet and answer any questions.","The research nurse or clinical team member will explain the information sheet and answer any questions.","2019-11-18 09:16:36","2019-11-18 09:16:36",419,419,19,19
1155,1155,A3EIM0G0H9D23X,A3EIM0G0H9D23X,4,4,450,450,"We can help you get more support if you find your experience is difficult.","We can help you get more support if you find your experience is difficult.","2019-11-18 09:16:39","2019-11-18 09:16:39",419,419,21,21
1156,1156,A3EIM0G0H9D23X,A3EIM0G0H9D23X,2,2,232,232,"You will be asked whether you're happy to take part in the study after reading the information sheet, and asking any questions you may have.","You will be asked whether you're happy to take part in the study after reading the information sheet, and asking any questions you may have.","2019-11-18 09:17:59","2019-11-18 09:17:59",419,419,21,21
1157,1157,A25RJ54AHZGDOO,A25RJ54AHZGDOO,4,4,418,418,"We are researching how diagnosis and treatment of prostate cancer affects a person's overall well-being.","We are researching how diagnosis and treatment of prostate cancer affects a person's overall well-being.","2019-11-18 09:21:42","2019-11-18 09:21:42",419,419,19,19
1158,1158,A25RJ54AHZGDOO,A25RJ54AHZGDOO,4,4,450,450,"Should you find any aspect of your experience difficult, we can provide details of where to find more support.","Should you find any aspect of your experience difficult, we can provide details of where to find more support.","2019-11-18 09:23:58","2019-11-18 09:23:58",419,419,19,19
1159,1159,A2T9C4MFZM0YL0,A2T9C4MFZM0YL0,2,2,0,0,,,"2019-11-18 09:48:14","2019-11-18 09:48:14",419,419,21,21
1160,1160,A2T9C4MFZM0YL0,A2T9C4MFZM0YL0,2,2,264,264,"The data gathered from your participation in the study will be used for further research. ","The data gathered from your participation in the study will be used for further research. ","2019-11-18 09:49:20","2019-11-18 09:49:20",419,419,21,21
1161,1161,A7X2K7IW80TBU,A7X2K7IW80TBU,2,2,0,0,,,"2019-11-18 09:50:46","2019-11-18 09:50:46",419,419,21,21
1162,1162,A2T9C4MFZM0YL0,A2T9C4MFZM0YL0,2,2,2100,2100,"Once agreed, we will collect your NHS data via hospital numbers but will be removed later. ","Once agreed, we will collect your NHS data via hospital numbers but will be removed later. ","2019-11-18 09:51:04","2019-11-18 09:51:04",419,419,21,21
1163,1163,A2T9C4MFZM0YL0,A2T9C4MFZM0YL0,3,3,312,312,"Men with Prostate Cancer can use a workshop in the care programme to help and manage any issues they have. ","Men with Prostate Cancer can use a workshop in the care programme to help and manage any issues they have. ","2019-11-18 09:51:58","2019-11-18 09:51:58",419,419,21,21
1164,1164,A2T9C4MFZM0YL0,A2T9C4MFZM0YL0,3,3,319,319,"It is completely voluntary to take part in this study and your medical care wont be affected in any way otherwise. ","It is completely voluntary to take part in this study and your medical care wont be affected in any way otherwise. ","2019-11-18 09:52:53","2019-11-18 09:52:53",419,419,21,21
1165,1165,A7X2K7IW80TBU,A7X2K7IW80TBU,2,2,264,264,"When you agree to being part of a research study, we use your answers for our research, but we will only use your information for reasons connected to the study.","When you agree to being part of a research study, we use your answers for our research, but we will only use your information for reasons connected to the study.","2019-11-18 09:53:40","2019-11-18 09:53:40",419,419,21,21
1166,1166,A2T9C4MFZM0YL0,A2T9C4MFZM0YL0,3,3,346,346,"The aim of this research is to enhance discussion on men with prostate cancer and your participation helps to enable this. ","The aim of this research is to enhance discussion on men with prostate cancer and your participation helps to enable this. ","2019-11-18 09:54:24","2019-11-18 09:54:24",419,419,21,21
1167,1167,A2T9C4MFZM0YL0,A2T9C4MFZM0YL0,4,4,406,406,"Any questions you have can be answered by the research nurses of clinical team members. ","Any questions you have can be answered by the research nurses of clinical team members. ","2019-11-18 09:54:53","2019-11-18 09:54:53",419,419,21,21
1168,1168,A2T9C4MFZM0YL0,A2T9C4MFZM0YL0,4,4,418,418,"We want to know how a prostate cancer diagnosis affects a persons health.","We want to know how a prostate cancer diagnosis affects a persons health.","2019-11-18 09:55:21","2019-11-18 09:55:21",419,419,21,21
1169,1169,A7X2K7IW80TBU,A7X2K7IW80TBU,2,2,2100,2100,"We will keep your data on our records with your NHS and hospital numbers so that we can keep track of it, but we will not use your name.","We will keep your data on our records with your NHS and hospital numbers so that we can keep track of it, but we will not use your name.","2019-11-18 09:55:30","2019-11-18 09:55:30",419,419,21,21
1170,1170,A7X2K7IW80TBU,A7X2K7IW80TBU,3,3,312,312,"The Care Programme includes a workshop for men with prostate cancer, which is there to help with managing anything related to prostate cancer.","The Care Programme includes a workshop for men with prostate cancer, which is there to help with managing anything related to prostate cancer.","2019-11-18 09:56:23","2019-11-18 09:56:23",419,419,21,21
