idCrwRevision,0,idReviser,1,idLeaflet,2,idSentence,3,crwRevision,4,dateT,5,flag,6,idGroup,7
316,316,COPIEDA2WG63TQT4LVPG,COPIEDA2WG63TQT4LVPG,4,4,36,36,"We can provide you with more support if there is something you struggling with.","We can provide you with more support if there is something you struggling with.","2019-08-21 21:57:11","2019-08-21 21:57:11",123,123,41,41
317,317,COPIEDA2WG63TQT4LVPG,COPIEDA2WG63TQT4LVPG,4,4,32,32,"Localised prostate cancer is cancer that hasn't spread anywhere else in the body.","Localised prostate cancer is cancer that hasn't spread anywhere else in the body.","2019-08-21 22:00:08","2019-08-21 22:00:08",123,123,41,41
318,318,COPIEDA2WG63TQT4LVPG,COPIEDA2WG63TQT4LVPG,4,4,27,27,"Only people who will need to work with your data can have access to them.","Only people who will need to work with your data can have access to them.","2019-08-21 22:02:24","2019-08-21 22:02:24",123,123,41,41
319,319,AUN1LGCVAUMIK,AUN1LGCVAUMIK,3,3,24,24,"This research try to develop a workshop for men with prostate cancer, and your help will be useful to do this","This research try to develop a workshop for men with prostate cancer, and your help will be useful to do this","2019-08-21 22:39:42","2019-08-21 22:39:42",123,123,31,31
320,320,AUN1LGCVAUMIK,AUN1LGCVAUMIK,3,3,18,18,"You will be given an identification  number at the star of the study. Your name and address will not be recorded in the questionnaire.","You will be given an identification  number at the star of the study. Your name and address will not be recorded in the questionnaire.","2019-08-21 22:41:09","2019-08-21 22:41:09",123,123,31,31
321,321,AUN1LGCVAUMIK,AUN1LGCVAUMIK,3,3,15,15,"If, after reading this information, you want to take part of the study, pleasde complete the questionnaire and return it to the researcher in the workshop or mail us to the University of Southampton.  ","If, after reading this information, you want to take part of the study, pleasde complete the questionnaire and return it to the researcher in the workshop or mail us to the University of Southampton.  ","2019-08-21 22:43:11","2019-08-21 22:43:11",123,123,31,31
322,322,A27QIBL4MO6Z0X,A27QIBL4MO6Z0X,3,3,24,24,"your views on this research will help develop a workshop for men with prostrate cancer ","your views on this research will help develop a workshop for men with prostrate cancer ","2019-08-21 22:59:25","2019-08-21 22:59:25",123,123,31,31
323,323,A27QIBL4MO6Z0X,A27QIBL4MO6Z0X,3,3,18,18,"the number allocated to you at the start of the study will be used to idenyify your data","the number allocated to you at the start of the study will be used to idenyify your data","2019-08-21 23:02:19","2019-08-21 23:02:19",123,123,31,31
324,324,A27QIBL4MO6Z0X,A27QIBL4MO6Z0X,3,3,15,15,"if you are happy to take part after reading the information please complete the questionnaire and return it to the researcher at the workshop or send it to us at the university of Southampton","if you are happy to take part after reading the information please complete the questionnaire and return it to the researcher at the workshop or send it to us at the university of Southampton","2019-08-21 23:05:35","2019-08-21 23:05:35",123,123,31,31
325,325,l2w2cg,l2w2cg,2,2,232,232,cg,cg,"2019-08-26 13:54:05","2019-08-26 13:54:05",123,123,22,22
326,326,l2w2cg,l2w2cg,2,2,2112,2112,2112,2112,"2019-08-26 13:54:32","2019-08-26 13:54:32",123,123,22,22
327,327,l2w2cg,l2w2cg,2,2,227,227,227,227,"2019-08-26 13:54:46","2019-08-26 13:54:46",123,123,22,22
328,328,l2w2t,l2w2t,2,2,232,232,232,232,"2019-08-26 14:11:16","2019-08-26 14:11:16",123,123,121,121
329,329,l2w2t,l2w2t,2,2,2112,2112,2112,2112,"2019-08-26 14:11:29","2019-08-26 14:11:29",123,123,121,121
330,330,l2w2t,l2w2t,2,2,227,227,227,227,"2019-08-26 14:11:45","2019-08-26 14:11:45",123,123,121,121
331,331,l2w3t,l2w3t,2,2,11,11,2100,2100,"2019-08-26 14:15:50","2019-08-26 14:15:50",123,123,121,121
332,332,l2w3t,l2w3t,2,2,7,7,234,234,"2019-08-26 14:16:13","2019-08-26 14:16:13",123,123,121,121
333,333,l2w3t,l2w3t,2,2,2,2,283,283,"2019-08-26 14:16:35","2019-08-26 14:16:35",123,123,121,121
334,334,l3w2c,l3w2c,3,3,312,312,312,312,"2019-08-26 14:25:33","2019-08-26 14:25:33",123,123,32,32
335,335,l3w2c,l3w2c,3,3,319,319,319,319,"2019-08-26 14:25:59","2019-08-26 14:25:59",123,123,32,32
336,336,l3w2c,l3w2c,3,3,333,333,333,333,"2019-08-26 14:26:09","2019-08-26 14:26:09",123,123,32,32
337,337,l3w3c,l3w3c,3,3,324,324,324,324,"2019-08-26 14:28:22","2019-08-26 14:28:22",123,123,33,33
338,338,l3w3c,l3w3c,3,3,341,341,341,341,"2019-08-26 14:28:41","2019-08-26 14:28:41",123,123,33,33
339,339,l3w3c,l3w3c,3,3,343,343,343,343,"2019-08-26 14:29:01","2019-08-26 14:29:01",123,123,33,33
340,340,l4w2c,l4w2c,4,4,418,418,418,418,"2019-08-26 14:31:12","2019-08-26 14:31:12",123,123,42,42
341,341,l4w2c,l4w2c,4,4,472,472,472,472,"2019-08-26 14:42:56","2019-08-26 14:42:56",123,123,42,42
342,342,l4w2c,l4w2c,4,4,455,455,455,455,"2019-08-26 14:43:31","2019-08-26 14:43:31",123,123,42,42
343,343,l4w3c,l4w3c,4,4,406,406,406,406,"2019-08-26 14:45:48","2019-08-26 14:45:48",123,123,43,43
344,344,l3w3c,l3w3c,4,4,411,411,411,411,"2019-08-26 14:46:09","2019-08-26 14:46:09",123,123,43,43
345,345,l4w3c,l4w3c,4,4,433,433,433,433,"2019-08-26 14:46:48","2019-08-26 14:46:48",123,123,43,43
346,346,A29HORM8VKJ6O0,A29HORM8VKJ6O0,2,2,232,232,"Once you have read the information sheet and your questions have been answered, we will ask you if you are willing to take part in the study.
","Once you have read the information sheet and your questions have been answered, we will ask you if you are willing to take part in the study.
","2019-08-26 15:21:36","2019-08-26 15:21:36",123,123,22,22
347,347,A29HORM8VKJ6O0,A29HORM8VKJ6O0,2,2,2112,2112,"We will let your GP know that you are taking part and may let your GP know before sending out the questionnaire in case your contact details have changed.","We will let your GP know that you are taking part and may let your GP know before sending out the questionnaire in case your contact details have changed.","2019-08-26 15:23:42","2019-08-26 15:23:42",123,123,22,22
348,348,A29HORM8VKJ6O0,A29HORM8VKJ6O0,2,2,227,227,,,"2019-08-26 15:25:12","2019-08-26 15:25:12",123,123,22,22
349,349,A1I8EWT2DMNAKU,A1I8EWT2DMNAKU,4,4,418,418,"We are looking to see how a diagnosis of prostate cancer and the treatment given effects each person physical and mental health.","We are looking to see how a diagnosis of prostate cancer and the treatment given effects each person physical and mental health.","2019-08-26 15:26:04","2019-08-26 15:26:04",123,123,42,42
350,350,A1I8EWT2DMNAKU,A1I8EWT2DMNAKU,4,4,472,472,"The hospital will hold on to notes from this study for 10 year.","The hospital will hold on to notes from this study for 10 year.","2019-08-26 15:26:30","2019-08-26 15:26:30",123,123,42,42
351,351,A1I8EWT2DMNAKU,A1I8EWT2DMNAKU,4,4,455,455,"Under the data protection act it is necessary for trials to be in the best interest of the public.","Under the data protection act it is necessary for trials to be in the best interest of the public.","2019-08-26 15:27:01","2019-08-26 15:27:01",123,123,42,42
352,352,A29HORM8VKJ6O0,A29HORM8VKJ6O0,2,2,2100,2100,"If you agree for us to gather your NHS data this will be tracked using your personal identifying numbers but not your name.","If you agree for us to gather your NHS data this will be tracked using your personal identifying numbers but not your name.","2019-08-26 15:34:09","2019-08-26 15:34:09",123,123,23,23
353,353,A398EWYF8HJEDA,A398EWYF8HJEDA,4,4,406,406,"The research nurse or someone from your clinical team will walk you through the information sheet and answer all your questions.","The research nurse or someone from your clinical team will walk you through the information sheet and answer all your questions.","2019-08-26 15:38:38","2019-08-26 15:38:38",123,123,43,43
354,354,A398EWYF8HJEDA,A398EWYF8HJEDA,4,4,411,411,"We will be asking participants to fill out questionnaires on how men's health and well-being is after diagnosis and treatment.","We will be asking participants to fill out questionnaires on how men's health and well-being is after diagnosis and treatment.","2019-08-26 15:39:25","2019-08-26 15:39:25",123,123,43,43
355,355,A398EWYF8HJEDA,A398EWYF8HJEDA,4,4,433,433,"We are also collecting routine information for the TrueNTH Global Registry project.  This is data that is already collected by the NHS, such as clinical and treatment details.","We are also collecting routine information for the TrueNTH Global Registry project.  This is data that is already collected by the NHS, such as clinical and treatment details.","2019-08-26 15:40:33","2019-08-26 15:40:33",123,123,43,43
356,356,AUZUHON52J10U,AUZUHON52J10U,4,4,406,406,"One of your clinical team, or a research nurse, will review the information sheet with you, and try to answer any questions that you may have.","One of your clinical team, or a research nurse, will review the information sheet with you, and try to answer any questions that you may have.","2019-08-26 15:42:48","2019-08-26 15:42:48",123,123,43,43
357,357,AUZUHON52J10U,AUZUHON52J10U,4,4,411,411,"After your diagnosis and treatment, we are interested in finding out about your health and well-being, so we will ask you to fill out a post-treatment questionnaire.","After your diagnosis and treatment, we are interested in finding out about your health and well-being, so we will ask you to fill out a post-treatment questionnaire.","2019-08-26 15:46:05","2019-08-26 15:46:05",123,123,43,43
358,358,AXID3RPK6NZT6,AXID3RPK6NZT6,4,4,406,406,"One of your clicical team will answer any queries you may have.","One of your clicical team will answer any queries you may have.","2019-08-26 15:48:57","2019-08-26 15:48:57",123,123,43,43
359,359,AXID3RPK6NZT6,AXID3RPK6NZT6,4,4,411,411,"We will ask you to answer some questions regarding your after-care.","We will ask you to answer some questions regarding your after-care.","2019-08-26 15:49:38","2019-08-26 15:49:38",123,123,43,43
360,360,AXID3RPK6NZT6,AXID3RPK6NZT6,4,4,433,433,"We will also be using the information you provide to update a number of records.","We will also be using the information you provide to update a number of records.","2019-08-26 15:50:29","2019-08-26 15:50:29",123,123,43,43
361,361,AUZUHON52J10U,AUZUHON52J10U,4,4,433,433,"We are contribute clinical and treatment information, via medical records and other national databases (such as the Health and Social Care Information Centre) to the TrueNTH Global Registry project that is supported by the NHS.","We are contribute clinical and treatment information, via medical records and other national databases (such as the Health and Social Care Information Centre) to the TrueNTH Global Registry project that is supported by the NHS.","2019-08-26 15:51:09","2019-08-26 15:51:09",123,123,43,43
362,362,AXID3RPK6NZT6,AXID3RPK6NZT6,4,4,418,418,"We are gathering informaion on the general effects of prostate cancer.","We are gathering informaion on the general effects of prostate cancer.","2019-08-26 15:54:20","2019-08-26 15:54:20",123,123,42,42
363,363,AXID3RPK6NZT6,AXID3RPK6NZT6,4,4,472,472,"You data will be destroyed after ten years.","You data will be destroyed after ten years.","2019-08-26 15:54:36","2019-08-26 15:54:36",123,123,42,42
364,364,AXID3RPK6NZT6,AXID3RPK6NZT6,4,4,455,455,"Gathering your data for trials is secure and very nenefical for many reasons.","Gathering your data for trials is secure and very nenefical for many reasons.","2019-08-26 15:55:36","2019-08-26 15:55:36",123,123,42,42
365,365,A3T8E8EB9HUYOS,A3T8E8EB9HUYOS,4,4,406,406,"The nurse or member of your team will go through the information sheet and answer any questions.","The nurse or member of your team will go through the information sheet and answer any questions.","2019-08-26 15:58:00","2019-08-26 15:58:00",123,123,43,43
366,366,A3T8E8EB9HUYOS,A3T8E8EB9HUYOS,4,4,411,411,"We will ask people to complete questionnaires to find how men's health is after treatment.","We will ask people to complete questionnaires to find how men's health is after treatment.","2019-08-26 15:58:49","2019-08-26 15:58:49",123,123,43,43
367,367,AXID3RPK6NZT6,AXID3RPK6NZT6,3,3,324,324,"You can fill in the questionnaire today or do it at home and send it to us using the prepaid enevelope provided.","You can fill in the questionnaire today or do it at home and send it to us using the prepaid enevelope provided.","2019-08-26 15:59:17","2019-08-26 15:59:17",123,123,33,33
368,368,A3T8E8EB9HUYOS,A3T8E8EB9HUYOS,4,4,433,433,"We are also gathering information for the TrueNTH Global Registry project that is collected by the NHS. For example, treatment details in medical records and databases such as the Health and Social Care Information Centre and other UK bodies.","We are also gathering information for the TrueNTH Global Registry project that is collected by the NHS. For example, treatment details in medical records and databases such as the Health and Social Care Information Centre and other UK bodies.","2019-08-26 15:59:51","2019-08-26 15:59:51",123,123,43,43
369,369,AXID3RPK6NZT6,AXID3RPK6NZT6,3,3,341,341,"All of your personal details will be securely stored anonymously.","All of your personal details will be securely stored anonymously.","2019-08-26 15:59:53","2019-08-26 15:59:53",123,123,33,33
370,370,AXID3RPK6NZT6,AXID3RPK6NZT6,3,3,343,343,"Only members of the research team will have access to your data.","Only members of the research team will have access to your data.","2019-08-26 16:00:18","2019-08-26 16:00:18",123,123,33,33
371,371,A3T8E8EB9HUYOS,A3T8E8EB9HUYOS,4,4,418,418,"We are interested in how prostate cancer affects health and well-being.","We are interested in how prostate cancer affects health and well-being.","2019-08-26 16:02:26","2019-08-26 16:02:26",123,123,42,42
372,372,A3T8E8EB9HUYOS,A3T8E8EB9HUYOS,4,4,472,472,"Your hospital will keep information about you for 10 years after this study has finished.","Your hospital will keep information about you for 10 years after this study has finished.","2019-08-26 16:02:47","2019-08-26 16:02:47",123,123,42,42
373,373,AXID3RPK6NZT6,AXID3RPK6NZT6,2,2,2100,2100,"Any routine data we collect from you will be totally anonymous.","Any routine data we collect from you will be totally anonymous.","2019-08-26 16:03:16","2019-08-26 16:03:16",123,123,23,23
374,374,AXID3RPK6NZT6,AXID3RPK6NZT6,2,2,234,234,"You can complete the form here today, or take it home and do it there using the supplied envelope to return it.","You can complete the form here today, or take it home and do it there using the supplied envelope to return it.","2019-08-26 16:03:50","2019-08-26 16:03:50",123,123,23,23
375,375,A3T8E8EB9HUYOS,A3T8E8EB9HUYOS,4,4,455,455,"Your information is necessary for the task carried out in the public interest (GDPR Article 6(1)(e) and under Article (2)(j) necessary for archiving purposes in the public interest, scientific or historical research purposes Article 89 (1).","Your information is necessary for the task carried out in the public interest (GDPR Article 6(1)(e) and under Article (2)(j) necessary for archiving purposes in the public interest, scientific or historical research purposes Article 89 (1).","2019-08-26 16:04:09","2019-08-26 16:04:09",123,123,42,42
376,376,AXID3RPK6NZT6,AXID3RPK6NZT6,2,2,283,283,"Your data may be shared with other organisations conducting similar studies.","Your data may be shared with other organisations conducting similar studies.","2019-08-26 16:04:15","2019-08-26 16:04:15",123,123,23,23
377,377,A1LT7RCP5NZQXG,A1LT7RCP5NZQXG,4,4,418,418,"We want to know how someone's prostate cancer diagnosis and treatment can affect them.","We want to know how someone's prostate cancer diagnosis and treatment can affect them.","2019-08-26 16:24:04","2019-08-26 16:24:04",123,123,42,42
378,378,A22FS22LAPMD8W,A22FS22LAPMD8W,2,2,2100,2100,"Your NHS data will only be tracked via your NHS and hospital number, should you have agreed to the survey.","Your NHS data will only be tracked via your NHS and hospital number, should you have agreed to the survey.","2019-08-26 16:24:39","2019-08-26 16:24:39",123,123,23,23
379,379,A1LT7RCP5NZQXG,A1LT7RCP5NZQXG,4,4,472,472,"Your hospital will keep your information for 10 years after this study.","Your hospital will keep your information for 10 years after this study.","2019-08-26 16:24:49","2019-08-26 16:24:49",123,123,42,42
380,380,A22FS22LAPMD8W,A22FS22LAPMD8W,2,2,234,234,"The questionnaire can be completed during a hospital visit, or it can be completed at home and turned via a pre-paid envelope.","The questionnaire can be completed during a hospital visit, or it can be completed at home and turned via a pre-paid envelope.","2019-08-26 16:25:18","2019-08-26 16:25:18",123,123,23,23
381,381,A2XD5QTL6H2LIY,A2XD5QTL6H2LIY,4,4,406,406,"Any questions you have from the information sheet will be answered by the research nurse or member of the clinical team. ","Any questions you have from the information sheet will be answered by the research nurse or member of the clinical team. ","2019-08-26 16:25:46","2019-08-26 16:25:46",123,123,43,43
382,382,A22FS22LAPMD8W,A22FS22LAPMD8W,2,2,283,283,"If you agree to take part in a study, the information collected on your health may be provided to other research organisations.","If you agree to take part in a study, the information collected on your health may be provided to other research organisations.","2019-08-26 16:25:55","2019-08-26 16:25:55",123,123,23,23
383,383,A1LT7RCP5NZQXG,A1LT7RCP5NZQXG,4,4,455,455,"We need to process your information as this task is carried out in the interests of the country.","We need to process your information as this task is carried out in the interests of the country.","2019-08-26 16:26:08","2019-08-26 16:26:08",123,123,42,42
384,384,A2XD5QTL6H2LIY,A2XD5QTL6H2LIY,4,4,411,411,"Men's health and well-being will be assessed with a questionnaire after diagnosis and treatment. ","Men's health and well-being will be assessed with a questionnaire after diagnosis and treatment. ","2019-08-26 16:26:45","2019-08-26 16:26:45",123,123,43,43
385,385,A2XD5QTL6H2LIY,A2XD5QTL6H2LIY,4,4,433,433,"The NHS, through the TrueNTH global registry, routinely collects further information, such as clinical and treatment through medical records and national databases. ","The NHS, through the TrueNTH global registry, routinely collects further information, such as clinical and treatment through medical records and national databases. ","2019-08-26 16:29:41","2019-08-26 16:29:41",123,123,43,43
386,386,A22FS22LAPMD8W,A22FS22LAPMD8W,3,3,312,312,"Part of the care programme will aim to help patients with prostate cancer manage the issues they face.","Part of the care programme will aim to help patients with prostate cancer manage the issues they face.","2019-08-26 16:32:35","2019-08-26 16:32:35",123,123,32,32
387,387,A22FS22LAPMD8W,A22FS22LAPMD8W,3,3,319,319,"Taking part in this research will not affect medical care should you wish to not take part, it is voluntary.","Taking part in this research will not affect medical care should you wish to not take part, it is voluntary.","2019-08-26 16:33:10","2019-08-26 16:33:10",123,123,32,32
388,388,A22FS22LAPMD8W,A22FS22LAPMD8W,3,3,333,333,"Taking part will potentially not benefit you directly, the results will help further research for prostate cancer however.","Taking part will potentially not benefit you directly, the results will help further research for prostate cancer however.","2019-08-26 16:34:18","2019-08-26 16:34:18",123,123,32,32
389,389,A22FS22LAPMD8W,A22FS22LAPMD8W,3,3,324,324,"The questionnaire can be completed at the workshop, or returned afterwards in a provided freepost envelope.","The questionnaire can be completed at the workshop, or returned afterwards in a provided freepost envelope.","2019-08-26 16:38:35","2019-08-26 16:38:35",123,123,33,33
390,390,A22FS22LAPMD8W,A22FS22LAPMD8W,3,3,341,341,"The information collected during the study and the results published will not identify you.","The information collected during the study and the results published will not identify you.","2019-08-26 16:39:22","2019-08-26 16:39:22",123,123,33,33
391,391,A22FS22LAPMD8W,A22FS22LAPMD8W,3,3,343,343,"All personal details will be stored securely and will only be accessible to authorised members of the University of Southampton research team.","All personal details will be stored securely and will only be accessible to authorised members of the University of Southampton research team.","2019-08-26 16:40:02","2019-08-26 16:40:02",123,123,33,33
392,392,A22FS22LAPMD8W,A22FS22LAPMD8W,4,4,406,406,"A member of the clinical team will provide you with information and answer any questions you have.","A member of the clinical team will provide you with information and answer any questions you have.","2019-08-26 16:45:37","2019-08-26 16:45:37",123,123,43,43
393,393,A22FS22LAPMD8W,A22FS22LAPMD8W,4,4,411,411,"Participants will complete a questionnaire after diagnosis and treatment to find out health and well-being.","Participants will complete a questionnaire after diagnosis and treatment to find out health and well-being.","2019-08-26 16:46:20","2019-08-26 16:46:20",123,123,43,43
394,394,ARYZT0RO8N5P1,ARYZT0RO8N5P1,2,2,232,232,"Once you have read the information sheet and have your questions answered, you'll be asked if you are willing to take part.","Once you have read the information sheet and have your questions answered, you'll be asked if you are willing to take part.","2019-08-26 16:46:53","2019-08-26 16:46:53",123,123,22,22
395,395,ARYZT0RO8N5P1,ARYZT0RO8N5P1,2,2,2112,2112,"We'll let your GP know that you're taking part in a study, we also may contact your GP before sending you the questionnaire regarding post-study
to make sure we have the right information.","We'll let your GP know that you're taking part in a study, we also may contact your GP before sending you the questionnaire regarding post-study
to make sure we have the right information.","2019-08-26 16:47:46","2019-08-26 16:47:46",123,123,22,22
396,396,A22FS22LAPMD8W,A22FS22LAPMD8W,4,4,433,433,"The study is also gathering data for the TrueNTH Global Registry project, an NHS project. This project collects clinical and treatment data from UK health bodies.","The study is also gathering data for the TrueNTH Global Registry project, an NHS project. This project collects clinical and treatment data from UK health bodies.","2019-08-26 16:47:59","2019-08-26 16:47:59",123,123,43,43
397,397,ARYZT0RO8N5P1,ARYZT0RO8N5P1,2,2,227,227,"Some studies collect data about people from their medical records, but we think it's important to find out about yourself by using your own perspective, we'll do this by looking at your responses to the questionnaires.","Some studies collect data about people from their medical records, but we think it's important to find out about yourself by using your own perspective, we'll do this by looking at your responses to the questionnaires.","2019-08-26 16:48:46","2019-08-26 16:48:46",123,123,22,22
398,398,A22FS22LAPMD8W,A22FS22LAPMD8W,2,2,232,232,"If your questions have been answered on the info sheet, indicate whether you are happy to take part in the study.","If your questions have been answered on the info sheet, indicate whether you are happy to take part in the study.","2019-08-26 16:53:02","2019-08-26 16:53:02",123,123,22,22
399,399,A22FS22LAPMD8W,A22FS22LAPMD8W,2,2,2112,2112,"Your GP will be informed you are taking part, and may contact your GP before the questionnaire if your details have changed.","Your GP will be informed you are taking part, and may contact your GP before the questionnaire if your details have changed.","2019-08-26 16:53:57","2019-08-26 16:53:57",123,123,22,22
400,400,A22FS22LAPMD8W,A22FS22LAPMD8W,2,2,227,227,"Many studies collect data from medical and hospital records. But we feel it is important to get your perspective on your health from questionnaires.","Many studies collect data from medical and hospital records. But we feel it is important to get your perspective on your health from questionnaires.","2019-08-26 16:54:39","2019-08-26 16:54:39",123,123,22,22
401,401,A2XD5QTL6H2LIY,A2XD5QTL6H2LIY,2,2,232,232,"You will be asked whether you are happy to take part in the study after you have read the information sheet and had any questions answered.","You will be asked whether you are happy to take part in the study after you have read the information sheet and had any questions answered.","2019-08-26 16:55:06","2019-08-26 16:55:06",123,123,22,22
402,402,A2XD5QTL6H2LIY,A2XD5QTL6H2LIY,2,2,2112,2112,"In case you have moved or details have changed we may contact your GP before mailing out the follow questionnaire.","In case you have moved or details have changed we may contact your GP before mailing out the follow questionnaire.","2019-08-26 16:56:07","2019-08-26 16:56:07",123,123,22,22
403,403,A2XD5QTL6H2LIY,A2XD5QTL6H2LIY,2,2,227,227,"We believe it is more important to find out about your health and well-being from your perspective instead of collecting data from medical and clinical records like other studies. ","We believe it is more important to find out about your health and well-being from your perspective instead of collecting data from medical and clinical records like other studies. ","2019-08-26 16:57:20","2019-08-26 16:57:20",123,123,22,22
404,404,AZJJM4MLJN12F,AZJJM4MLJN12F,4,4,418,418,"The affect a diagnosis of prostate cancer and its treatment has on an individual's health is of great interest.","The affect a diagnosis of prostate cancer and its treatment has on an individual's health is of great interest.","2019-08-26 16:58:13","2019-08-26 16:58:13",123,123,42,42
