idCrwRevision,0,idReviser,1,idLeaflet,2,idSentence,3,crwRevision,4,dateT,5,flag,6,idGroup,7
618,618,A1KCKKMDKHADNC,A1KCKKMDKHADNC,2,2,234,234,"Once you have competed the questionnaire hand it to a nurse or researcher or take it home and post it in the pre-paid envelope.","Once you have competed the questionnaire hand it to a nurse or researcher or take it home and post it in the pre-paid envelope.","2019-08-29 21:34:43","2019-08-29 21:34:43",123,123,123,123
619,619,A1KCKKMDKHADNC,A1KCKKMDKHADNC,2,2,283,283,"If you take part in the study, your health and care information may be provided to other researchers running research studies in other organisations.","If you take part in the study, your health and care information may be provided to other researchers running research studies in other organisations.","2019-08-29 21:35:58","2019-08-29 21:35:58",123,123,123,123
620,620,A3KS9SFKQR3XVY,A3KS9SFKQR3XVY,2,2,2100,2100,"Upon agreement of sharing your NHS data, we will track your hospital numbers, but your name will be removed.","Upon agreement of sharing your NHS data, we will track your hospital numbers, but your name will be removed.","2019-08-29 22:20:46","2019-08-29 22:20:46",123,123,123,123
621,621,A3KS9SFKQR3XVY,A3KS9SFKQR3XVY,2,2,234,234,"Your questionnaire can be completed at the hospital and submitted to the nurse or researcher, or can be completed at home and returned via the pre-paid envelope provided.","Your questionnaire can be completed at the hospital and submitted to the nurse or researcher, or can be completed at home and returned via the pre-paid envelope provided.","2019-08-29 22:23:52","2019-08-29 22:23:52",123,123,123,123
622,622,A3KS9SFKQR3XVY,A3KS9SFKQR3XVY,2,2,283,283,"Once you take part in the research study, your health and care information will be shared will research studies in this organization and other organizations.","Once you take part in the research study, your health and care information will be shared will research studies in this organization and other organizations.","2019-08-29 22:27:32","2019-08-29 22:27:32",123,123,123,123
623,623,A3L6JNFBB7DQBO,A3L6JNFBB7DQBO,2,2,2100,2100,"We will record your NHS data using your NHS and hospital number. Your name will be removed.","We will record your NHS data using your NHS and hospital number. Your name will be removed.","2019-08-30 07:25:43","2019-08-30 07:25:43",123,123,123,123
624,624,A3L6JNFBB7DQBO,A3L6JNFBB7DQBO,2,2,234,234,"You can complete the questionnaire during your hospital visit or at home and return it using the prepaid envelope.","You can complete the questionnaire during your hospital visit or at home and return it using the prepaid envelope.","2019-08-30 07:26:52","2019-08-30 07:26:52",123,123,123,123
625,625,A3L6JNFBB7DQBO,A3L6JNFBB7DQBO,2,2,283,283,"The information about your health and care may be shared with other researchers, either in this organisation or in other organisations.","The information about your health and care may be shared with other researchers, either in this organisation or in other organisations.","2019-08-30 07:28:13","2019-08-30 07:28:13",123,123,123,123
626,626,A13T8GV5PDF82B,A13T8GV5PDF82B,4,4,406,406,"The nurse will go through the information sheet and answer any questions you have.","The nurse will go through the information sheet and answer any questions you have.","2019-08-30 11:32:40","2019-08-30 11:32:40",123,123,143,143
627,627,A13T8GV5PDF82B,A13T8GV5PDF82B,4,4,411,411,"We're asking participants to fill out questionnaires about their health after treatment.","We're asking participants to fill out questionnaires about their health after treatment.","2019-08-30 11:33:25","2019-08-30 11:33:25",123,123,143,143
628,628,A13T8GV5PDF82B,A13T8GV5PDF82B,4,4,433,433,"We are collecting information for the TrueNTH Global Registry project that is collected by the NHS.","We are collecting information for the TrueNTH Global Registry project that is collected by the NHS.","2019-08-30 11:34:01","2019-08-30 11:34:01",123,123,143,143
629,629,A2KMK30K2TDDNH,A2KMK30K2TDDNH,3,3,324,324,"The questionnaire can be completed at the end of the session or at home and returned to us in a free post envelope.

","The questionnaire can be completed at the end of the session or at home and returned to us in a free post envelope.

","2019-08-30 11:34:36","2019-08-30 11:34:36",123,123,133,133
630,630,A2KMK30K2TDDNH,A2KMK30K2TDDNH,3,3,341,341,"None of the information collected about you or the results published will identify you personally","None of the information collected about you or the results published will identify you personally","2019-08-30 11:35:29","2019-08-30 11:35:29",123,123,133,133
631,631,A3L6JNFBB7DQBO,A3L6JNFBB7DQBO,3,3,324,324,"Please complete this questionnaire now and hand it over to the nurse. You can also return it using the Freepost envelope given. ","Please complete this questionnaire now and hand it over to the nurse. You can also return it using the Freepost envelope given. ","2019-08-30 11:36:19","2019-08-30 11:36:19",123,123,133,133
632,632,A2KMK30K2TDDNH,A2KMK30K2TDDNH,3,3,343,343,"All personal details you provide will be stored securely in filing cabinets or password protected computers which are only accessible by members of the University research team.","All personal details you provide will be stored securely in filing cabinets or password protected computers which are only accessible by members of the University research team.","2019-08-30 11:36:41","2019-08-30 11:36:41",123,123,133,133
633,633,A3L6JNFBB7DQBO,A3L6JNFBB7DQBO,3,3,341,341,"All information and results collected will remain anonymous.","All information and results collected will remain anonymous.","2019-08-30 11:37:29","2019-08-30 11:37:29",123,123,133,133
634,634,A3L6JNFBB7DQBO,A3L6JNFBB7DQBO,3,3,343,343,"All personal information will be protected and shared only within the university staff.","All personal information will be protected and shared only within the university staff.","2019-08-30 11:39:31","2019-08-30 11:39:31",123,123,133,133
635,635,A2XD5QTL6H2LIY,A2XD5QTL6H2LIY,3,3,324,324,"The questionnaire can be completed at the end of the workshop session, or at home and returned in the provided freepost envelope.","The questionnaire can be completed at the end of the workshop session, or at home and returned in the provided freepost envelope.","2019-08-30 11:43:14","2019-08-30 11:43:14",123,123,133,133
636,636,A2XD5QTL6H2LIY,A2XD5QTL6H2LIY,3,3,341,341,"None of the data collected during the study or published results will identify you personally.","None of the data collected during the study or published results will identify you personally.","2019-08-30 11:44:36","2019-08-30 11:44:36",123,123,133,133
637,637,A2XD5QTL6H2LIY,A2XD5QTL6H2LIY,3,3,343,343,"All personal details will be held securely in locked filling cabinets and password protected computers and only accessible by members of the University of Southampton research team.","All personal details will be held securely in locked filling cabinets and password protected computers and only accessible by members of the University of Southampton research team.","2019-08-30 11:46:42","2019-08-30 11:46:42",123,123,133,133
638,638,AXID3RPK6NZT6,AXID3RPK6NZT6,4,4,406,406,"Our team will answer any questions you may have.","Our team will answer any questions you may have.","2019-08-30 11:51:11","2019-08-30 11:51:11",123,123,143,143
639,639,A13T8GV5PDF82B,A13T8GV5PDF82B,3,3,324,324,"The questionnaire can be completed at the end of the session or at home. ","The questionnaire can be completed at the end of the session or at home. ","2019-08-30 11:51:39","2019-08-30 11:51:39",123,123,133,133
640,640,AXID3RPK6NZT6,AXID3RPK6NZT6,4,4,411,411,"There will be a questionnaire to fill out for this study.","There will be a questionnaire to fill out for this study.","2019-08-30 11:51:40","2019-08-30 11:51:40",123,123,143,143
641,641,AXID3RPK6NZT6,AXID3RPK6NZT6,4,4,433,433,"We will also be sharing your data with other research groups.","We will also be sharing your data with other research groups.","2019-08-30 11:52:09","2019-08-30 11:52:09",123,123,143,143
642,642,A13T8GV5PDF82B,A13T8GV5PDF82B,3,3,341,341,"None of the information collected or results of the study published will identify you personally.","None of the information collected or results of the study published will identify you personally.","2019-08-30 11:52:12","2019-08-30 11:52:12",123,123,133,133
643,643,A13T8GV5PDF82B,A13T8GV5PDF82B,3,3,343,343,"All personal details will be locked and only accessible by members of the University of Southampton research team.","All personal details will be locked and only accessible by members of the University of Southampton research team.","2019-08-30 11:53:01","2019-08-30 11:53:01",123,123,133,133
644,644,AXID3RPK6NZT6,AXID3RPK6NZT6,3,3,324,324,"You can complete the form now, or do it at home later.","You can complete the form now, or do it at home later.","2019-08-30 11:54:50","2019-08-30 11:54:50",123,123,133,133
645,645,AXID3RPK6NZT6,AXID3RPK6NZT6,3,3,341,341,"You will remain anonymous in all data collected.","You will remain anonymous in all data collected.","2019-08-30 11:55:19","2019-08-30 11:55:19",123,123,133,133
646,646,AXID3RPK6NZT6,AXID3RPK6NZT6,3,3,343,343,"All of your personal data will be securely stored and only acessed by the research team.","All of your personal data will be securely stored and only acessed by the research team.","2019-08-30 11:55:52","2019-08-30 11:55:52",123,123,133,133
647,647,AEQ0FXD00UB2Z,AEQ0FXD00UB2Z,3,3,324,324,"The questionnaire can be completed at the end of the session, or at home and returned in the freepost envelope provided.","The questionnaire can be completed at the end of the session, or at home and returned in the freepost envelope provided.","2019-08-30 11:56:07","2019-08-30 11:56:07",123,123,133,133
648,648,AEQ0FXD00UB2Z,AEQ0FXD00UB2Z,3,3,341,341,"None of the information that is collected during the study, nor the results will identify you personally.","None of the information that is collected during the study, nor the results will identify you personally.","2019-08-30 11:57:11","2019-08-30 11:57:11",123,123,133,133
649,649,A300NSYGWVGOMM,A300NSYGWVGOMM,3,3,324,324,"Please complete the questionnaire when the workshop ends, either here or at home and return it in the provided freepost envelope.","Please complete the questionnaire when the workshop ends, either here or at home and return it in the provided freepost envelope.","2019-08-30 11:57:43","2019-08-30 11:57:43",123,123,133,133
650,650,AEQ0FXD00UB2Z,AEQ0FXD00UB2Z,3,3,343,343,"All personal details (e.g. name and address) will be stored separately in locked cabinets, on password protected computers, only accessible by members of the University of Southampton research team.","All personal details (e.g. name and address) will be stored separately in locked cabinets, on password protected computers, only accessible by members of the University of Southampton research team.","2019-08-30 11:58:22","2019-08-30 11:58:22",123,123,133,133
651,651,A300NSYGWVGOMM,A300NSYGWVGOMM,3,3,341,341,"You cannot be identified by any information we collect or publish.","You cannot be identified by any information we collect or publish.","2019-08-30 11:58:36","2019-08-30 11:58:36",123,123,133,133
652,652,A300NSYGWVGOMM,A300NSYGWVGOMM,3,3,343,343,"Your personal details can only be accessed by members of this research team. It is all stored securely in filing cabinets or on password protected computers.","Your personal details can only be accessed by members of this research team. It is all stored securely in filing cabinets or on password protected computers.","2019-08-30 11:59:50","2019-08-30 11:59:50",123,123,133,133
653,653,A1S25NBTJQC64E,A1S25NBTJQC64E,4,4,406,406,"A member of your medical team will go through the leaflet and answer any questions you have.","A member of your medical team will go through the leaflet and answer any questions you have.","2019-08-30 12:03:05","2019-08-30 12:03:05",123,123,143,143
654,654,AEQ0FXD00UB2Z,AEQ0FXD00UB2Z,4,4,406,406,"The research member of your clinical team will go through the information sheet with you and answer any questions you have.","The research member of your clinical team will go through the information sheet with you and answer any questions you have.","2019-08-30 12:03:23","2019-08-30 12:03:23",123,123,143,143
655,655,A1S25NBTJQC64E,A1S25NBTJQC64E,4,4,411,411,"Participants will complete a questionnaire about men's health and well-being after diagnosis and treatment.","Participants will complete a questionnaire about men's health and well-being after diagnosis and treatment.","2019-08-30 12:04:09","2019-08-30 12:04:09",123,123,143,143
656,656,AEQ0FXD00UB2Z,AEQ0FXD00UB2Z,4,4,411,411,"We will ask participants to complete questionnaires, to find out how men's health and wellbeing is after diagnosis and treatment.","We will ask participants to complete questionnaires, to find out how men's health and wellbeing is after diagnosis and treatment.","2019-08-30 12:04:16","2019-08-30 12:04:16",123,123,143,143
657,657,AEQ0FXD00UB2Z,AEQ0FXD00UB2Z,4,4,433,433,"Additionally, we are gathering information for the TrueNTH Global Registry project, that is routinely collected by the NHS, such as clinical and treatment details, from both medical records and national databases.","Additionally, we are gathering information for the TrueNTH Global Registry project, that is routinely collected by the NHS, such as clinical and treatment details, from both medical records and national databases.","2019-08-30 12:06:02","2019-08-30 12:06:02",123,123,143,143
658,658,A1S25NBTJQC64E,A1S25NBTJQC64E,4,4,433,433,"We're collecting information for the TrueNTH Global Registry project, collected routinely by the NHS, such as clinical and treatment details from records and databases from UK bodies.","We're collecting information for the TrueNTH Global Registry project, collected routinely by the NHS, such as clinical and treatment details from records and databases from UK bodies.","2019-08-30 12:09:05","2019-08-30 12:09:05",123,123,143,143
659,659,A1UYK7SUH7SQ6W,A1UYK7SUH7SQ6W,4,4,406,406,"The research nurse will answer any questions you have from the information sheet","The research nurse will answer any questions you have from the information sheet","2019-08-30 12:18:46","2019-08-30 12:18:46",123,123,143,143
660,660,A2FXX3H2NQCQB3,A2FXX3H2NQCQB3,4,4,406,406,"the research nurse or member of your clinical team will answer any questions you have.","the research nurse or member of your clinical team will answer any questions you have.","2019-08-30 12:22:53","2019-08-30 12:22:53",123,123,143,143
661,661,A1UYK7SUH7SQ6W,A1UYK7SUH7SQ6W,4,4,411,411,"You will be asked to complete a questionnaire on men's health and well-being after diagnosis and treatment","You will be asked to complete a questionnaire on men's health and well-being after diagnosis and treatment","2019-08-30 12:23:06","2019-08-30 12:23:06",123,123,143,143
662,662,A2FXX3H2NQCQB3,A2FXX3H2NQCQB3,4,4,411,411,"We will be asking participants to answer some questions to determinate how men's health is after diagnosis and treatment","We will be asking participants to answer some questions to determinate how men's health is after diagnosis and treatment","2019-08-30 12:25:32","2019-08-30 12:25:32",123,123,143,143
663,663,A2FXX3H2NQCQB3,A2FXX3H2NQCQB3,4,4,433,433,"we are also collecting information for the TrueNTH Global registry project that is routinely collected by the NHS, such as clinical and treatment details through all UK Information bodies.","we are also collecting information for the TrueNTH Global registry project that is routinely collected by the NHS, such as clinical and treatment details through all UK Information bodies.","2019-08-30 12:29:15","2019-08-30 12:29:15",123,123,143,143
664,664,A1UYK7SUH7SQ6W,A1UYK7SUH7SQ6W,4,4,433,433,"We are also gathering information including clinical and treatment details, both through medical records and national databases, which is routinely collected by the NHS, for the TrueNTH Global Registry project","We are also gathering information including clinical and treatment details, both through medical records and national databases, which is routinely collected by the NHS, for the TrueNTH Global Registry project","2019-08-30 12:32:39","2019-08-30 12:32:39",123,123,143,143
665,665,A2TZH3L7RO6RFS,A2TZH3L7RO6RFS,3,3,324,324,"The questionnaire can be completed at the end of the workshop session or at home using a freepost envelope provided for return.","The questionnaire can be completed at the end of the workshop session or at home using a freepost envelope provided for return.","2019-08-30 12:35:45","2019-08-30 12:35:45",123,123,133,133
666,666,A2TZH3L7RO6RFS,A2TZH3L7RO6RFS,3,3,341,341,"Information that is collected or the results published during the course of the study will not identify you personally.","Information that is collected or the results published during the course of the study will not identify you personally.","2019-08-30 12:37:49","2019-08-30 12:37:49",123,123,133,133
667,667,A2TZH3L7RO6RFS,A2TZH3L7RO6RFS,3,3,343,343,"All personal details (i.e. name or address) will be securely stored in locked filling cabinets and held on password protected computers only accessible by members of the University of Southampton research team.","All personal details (i.e. name or address) will be securely stored in locked filling cabinets and held on password protected computers only accessible by members of the University of Southampton research team.","2019-08-30 12:41:05","2019-08-30 12:41:05",123,123,133,133
668,668,A2T63C3AQSLSGA,A2T63C3AQSLSGA,4,4,406,406,"One of your medical team will explain the information sheet to you and answer any of your questions.","One of your medical team will explain the information sheet to you and answer any of your questions.","2019-08-30 13:00:04","2019-08-30 13:00:04",123,123,143,143
669,669,A25RJ54AHZGDOO,A25RJ54AHZGDOO,3,3,324,324,"The completed questionnaire can be handed in at the end of the workshop, or posted to us in the provided freepost envelope.","The completed questionnaire can be handed in at the end of the workshop, or posted to us in the provided freepost envelope.","2019-08-30 13:00:37","2019-08-30 13:00:37",123,123,133,133
670,670,A2T63C3AQSLSGA,A2T63C3AQSLSGA,4,4,411,411,"Using questionnaires, we are hoping to find out how men's health is affected after diagnosis and treatment.","Using questionnaires, we are hoping to find out how men's health is affected after diagnosis and treatment.","2019-08-30 13:01:02","2019-08-30 13:01:02",123,123,143,143
671,671,A2T63C3AQSLSGA,A2T63C3AQSLSGA,4,4,433,433,"Additionally, we are collecting data for the TrueNTH project. This data is routinely available through the NHS and includes treatment details from your medical records and other national databases.","Additionally, we are collecting data for the TrueNTH project. This data is routinely available through the NHS and includes treatment details from your medical records and other national databases.","2019-08-30 13:02:27","2019-08-30 13:02:27",123,123,143,143
672,672,A25RJ54AHZGDOO,A25RJ54AHZGDOO,3,3,341,341,"No information collected or results published will identify you.","No information collected or results published will identify you.","2019-08-30 13:02:37","2019-08-30 13:02:37",123,123,133,133
673,673,A25RJ54AHZGDOO,A25RJ54AHZGDOO,3,3,343,343,"All personal details (eg, name and address) will be securely stored in locked filing cabinets and on computers only accessible by the research team.","All personal details (eg, name and address) will be securely stored in locked filing cabinets and on computers only accessible by the research team.","2019-08-30 13:06:43","2019-08-30 13:06:43",123,123,133,133
674,674,A3OAH2XXHT3FOS,A3OAH2XXHT3FOS,4,4,406,406,,,"2019-08-30 13:16:37","2019-08-30 13:16:37",123,123,143,143
675,675,A3OAH2XXHT3FOS,A3OAH2XXHT3FOS,4,4,411,411,"I HAVE A PROBLEM TO SOLVE MY HEALTH PROBLEM","I HAVE A PROBLEM TO SOLVE MY HEALTH PROBLEM","2019-08-30 13:17:47","2019-08-30 13:17:47",123,123,143,143
676,676,A3OAH2XXHT3FOS,A3OAH2XXHT3FOS,4,4,433,433,"I HAVE A NEW PROBLEM TO SOLVE THE HEALTH ISSUE AFTER THE AGE OF 50 IN ALL COUNTRIES AND WE MUST FOLLOW THE PROPER DIET","I HAVE A NEW PROBLEM TO SOLVE THE HEALTH ISSUE AFTER THE AGE OF 50 IN ALL COUNTRIES AND WE MUST FOLLOW THE PROPER DIET","2019-08-30 13:19:50","2019-08-30 13:19:50",123,123,143,143
677,677,A3DD63B3AMQ9NP,A3DD63B3AMQ9NP,4,4,406,406,"A member of your clinical team will go through the information sheet and answer any questions.","A member of your clinical team will go through the information sheet and answer any questions.","2019-08-30 15:18:51","2019-08-30 15:18:51",123,123,143,143
678,678,A3DD63B3AMQ9NP,A3DD63B3AMQ9NP,4,4,411,411,"We will be asking participants to complete questionnaires to see how the treatment performs.","We will be asking participants to complete questionnaires to see how the treatment performs.","2019-08-30 15:19:57","2019-08-30 15:19:57",123,123,143,143
679,679,A3DD63B3AMQ9NP,A3DD63B3AMQ9NP,4,4,433,433,"We also gather information for the TrueNTH Global Registry project which cinludes information on treatment and medical records.","We also gather information for the TrueNTH Global Registry project which cinludes information on treatment and medical records.","2019-08-30 15:21:16","2019-08-30 15:21:16",123,123,143,143
680,680,132,132,2,2,232,232,,,"2019-09-09 15:04:42","2019-09-09 15:04:42",132,132,22,22
681,681,132,132,2,2,227,227,,,"2019-09-09 15:04:46","2019-09-09 15:04:46",132,132,22,22
682,682,v2,v2,2,2,0,0,,,"2019-09-09 19:40:18","2019-09-09 19:40:18",2123,2123,23,23
683,683,v2,v2,2,2,2100,2100,,,"2019-09-09 19:40:24","2019-09-09 19:40:24",2123,2123,23,23
684,684,v2,v2,2,2,234,234,,,"2019-09-09 19:40:27","2019-09-09 19:40:27",2123,2123,23,23
685,685,v2,v2,2,2,283,283,,,"2019-09-09 19:40:30","2019-09-09 19:40:30",2123,2123,23,23
686,686,o132,o132,2,2,0,0,,,"2019-09-09 20:01:39","2019-09-09 20:01:39",132,132,22,22
687,687,o132,o132,2,2,232,232,,,"2019-09-09 20:01:54","2019-09-09 20:01:54",132,132,22,22
688,688,v2,v2,2,2,0,0,,,"2019-09-09 20:15:40","2019-09-09 20:15:40",2123,2123,23,23
689,689,v2,v2,2,2,2100,2100,,,"2019-09-09 20:15:46","2019-09-09 20:15:46",2123,2123,23,23
690,690,v2,v2,2,2,234,234,,,"2019-09-09 20:15:50","2019-09-09 20:15:50",2123,2123,23,23
691,691,v2,v2,2,2,283,283,,,"2019-09-09 20:15:58","2019-09-09 20:15:58",2123,2123,23,23
692,692,o132,o132,2,2,0,0,,,"2019-09-09 20:21:26","2019-09-09 20:21:26",132,132,22,22
693,693,o132,o132,2,2,232,232,,,"2019-09-09 20:21:36","2019-09-09 20:21:36",132,132,22,22
694,694,o132,o132,2,2,227,227,,,"2019-09-09 20:21:42","2019-09-09 20:21:42",132,132,22,22
695,695,o132,o132,2,2,2112,2112,,,"2019-09-09 20:21:52","2019-09-09 20:21:52",132,132,22,22
696,696,A3SITW767PUHIN,A3SITW767PUHIN,2,2,0,0,,,"2019-09-09 20:30:55","2019-09-09 20:30:55",132,132,22,22
697,697,A3SITW767PUHIN,A3SITW767PUHIN,2,2,232,232,"You will be asked whether you are happy to take part in the study once you have read the information and asked any questions you have.","You will be asked whether you are happy to take part in the study once you have read the information and asked any questions you have.","2019-09-09 20:31:34","2019-09-09 20:31:34",132,132,22,22
698,698,A1RCBWN98I5B90,A1RCBWN98I5B90,2,2,0,0,,,"2019-09-09 20:31:54","2019-09-09 20:31:54",2123,2123,23,23
699,699,A3SITW767PUHIN,A3SITW767PUHIN,2,2,227,227,"We believe it is important to find out about your health and well-being from questionnaires you fill out and not just from your medical &amp; hospital records.","We believe it is important to find out about your health and well-being from questionnaires you fill out and not just from your medical &amp; hospital records.","2019-09-09 20:32:23","2019-09-09 20:32:23",132,132,22,22
700,700,A1RCBWN98I5B90,A1RCBWN98I5B90,2,2,2100,2100,"if you agree for us to collect and use your NHS data your name will be removed ","if you agree for us to collect and use your NHS data your name will be removed ","2019-09-09 20:32:48","2019-09-09 20:32:48",2123,2123,23,23
701,701,A3SITW767PUHIN,A3SITW767PUHIN,2,2,2112,2112,"Your GP will be informed about your study participation &amp; will also be contacted before we mail you the follow up questionnaire to ensure it reaches you. ","Your GP will be informed about your study participation &amp; will also be contacted before we mail you the follow up questionnaire to ensure it reaches you. ","2019-09-09 20:33:11","2019-09-09 20:33:11",132,132,22,22
702,702,A1RCBWN98I5B90,A1RCBWN98I5B90,2,2,234,234,"You can complete the questionnaire at the hospital and hand it in to a nurse of take it home and return in the prepaid envelope ","You can complete the questionnaire at the hospital and hand it in to a nurse of take it home and return in the prepaid envelope ","2019-09-09 20:33:57","2019-09-09 20:33:57",2123,2123,23,23
703,703,A3COQALEXT650,A3COQALEXT650,2,2,0,0,,,"2019-09-09 20:34:03","2019-09-09 20:34:03",2123,2123,23,23
704,704,A1RCBWN98I5B90,A1RCBWN98I5B90,2,2,283,283,"when you agree to take part in the study your information may be provided to different research studies","when you agree to take part in the study your information may be provided to different research studies","2019-09-09 20:34:55","2019-09-09 20:34:55",2123,2123,23,23
705,705,A3COQALEXT650,A3COQALEXT650,2,2,2100,2100,"If you allow us to collect data, it will only reference your NHS number","If you allow us to collect data, it will only reference your NHS number","2019-09-09 20:35:48","2019-09-09 20:35:48",2123,2123,23,23
